{
  "acceptance_checks": [
    {
      "check_id": "check-source-linkage",
      "check_type": "source_linkage",
      "expected": "The registered decision packet, executable verification receipt, and manifest retain their recorded SHA-256 values."
    },
    {
      "check_id": "check-target-hash",
      "check_type": "target_hash_unchanged",
      "expected": "The target remains at version 1.0.0 and its registered hash before any manual application."
    },
    {
      "check_id": "check-deterministic-replay",
      "check_type": "deterministic_replay",
      "expected": "Two runs from the same registered inputs produce byte-identical proposal artifacts."
    },
    {
      "check_id": "check-manual-content",
      "check_type": "manual_content_check",
      "expected": "After approval and manual application, exactly one instruction is appended under the feedback gate."
    }
  ],
  "actor": "user",
  "authorization_boundary": {
    "apply_status": "not_applied",
    "automatic_application": false,
    "human_review_status": "required",
    "requires_human_approval": true,
    "scientific_conclusion_allowed": false,
    "source_authority": "process_only_unapplied_policy_proposal",
    "source_human_acceptance_status": "pending",
    "verifier_bypass_allowed": false
  },
  "control_source": {
    "allowed_use": "process_only_unapplied_policy_proposal",
    "candidate": {
      "candidate_id": "evidence-gated-skill-induction",
      "file_sha256": "d3a6e7cf296b490261a2e4362ee0e915f1fa7c95595d89aa6c37c8259e44334a",
      "object_sha256": "9814e75db275d4dc75122783d6c4958c0b0e0b2c6c40985bf27fcca9242f5966",
      "path": "examples/candidate.json"
    },
    "decision_packet": {
      "packet_id": "packet-9814e75db275",
      "path": "examples/expected/decision_packet.json",
      "sha256": "2bd2d472d9a9572fce9f8f5f43d5d58f68ab83b1ecb244f4d990916150996996"
    },
    "human_acceptance_status": "pending",
    "manifest": {
      "path": "examples/expected/manifest.json",
      "sha256": "a759c26e1c96b0482d3c539d673fb52bb44f2714fc09c0b7e511179aa6753175"
    },
    "scientific_conclusion_allowed": false,
    "source_id": "source-public-control-receipt",
    "source_type": "bound_executable_verification_control",
    "verification_receipt": {
      "path": "examples/verification/pipeline_contract_receipt.json",
      "receipt_id": "receipt-pipeline-contract-v1",
      "sha256": "7f6b2f3e5581d59e83209cb7f9fee8d31a5d167019537c27ddf1ffce15346d3c"
    }
  },
  "feedback_id": "feedback-public-replay-gate",
  "feedback_kind": "workflow_preference",
  "feedback_scope": "single_component_single_change",
  "feedback_summary": "Require replay of the bound executable control receipt before a feedback-derived process policy patch can be manually accepted.",
  "non_goals": [
    "Do not create or strengthen any scientific claim from this preference event.",
    "Do not bypass, disable, or weaken any verifier or evidence gate.",
    "Do not modify a prompt, skill, schema, verifier, or registry automatically.",
    "Do not treat a bound control receipt as scientific success or human acceptance."
  ],
  "privacy_class": "synthetic_public_demo",
  "rollback_rule": {
    "action": "Restore the registered target bytes and replay the bound executable control verifier before reconsideration.",
    "restore_sha256": "9098771e0ecf8f95d324989666220eb22da416017931ebdfc1c981991f92c151",
    "restore_version": "1.0.0",
    "trigger": "Any declared acceptance check fails after a human-approved manual application."
  },
  "schema_version": "1.0",
  "signal_type": "user_feedback_signal",
  "single_change": {
    "operation": "append_instruction",
    "policy_action": "require_registered_control_receipt_replay",
    "proposed_version": "1.0.1",
    "rationale": "The explicit user preference asks for replayable control-source linkage before any workflow policy proposal is manually applied.",
    "requested_effect": "process_instruction_only",
    "target_location": "## Feedback gate"
  },
  "target_component": {
    "component_id": "component-research-loop-policy",
    "component_type": "prompt",
    "current_sha256": "9098771e0ecf8f95d324989666220eb22da416017931ebdfc1c981991f92c151",
    "current_version": "1.0.0",
    "path": "examples/evolution/components/research-loop-policy.md"
  }
}
